{"$schema":"http://json-schema.org/draft-07/schema#","type":"object","properties":{"activeChip":{"type":"null"},"automaticSubs":{"type":"array","items":{"type":"object","properties":{"entry":{"type":"integer"},"elementIn":{"type":"integer"},"elementOut":{"type":"integer"},"event":{"type":"integer"}}}},"entryHistory":{"type":"object","properties":{"event":{"type":"integer"},"points":{"type":"integer"},"totalPoints":{"type":"integer"},"rank":{"type":"integer"},"rankSort":{"type":"integer"},"overallRank":{"type":"integer"},"bank":{"type":"integer"},"value":{"type":"integer"},"eventTransfers":{"type":"integer"},"eventTransfersCost":{"type":"integer"},"pointsOnBench":{"type":"integer"}}},"picks":{"type":"array","items":{"type":"object","properties":{"element":{"type":"integer"},"position":{"type":"integer"},"multiplier":{"type":"integer"},"isCaptain":{"type":"boolean"},"isViceCaptain":{"type":"boolean"}}}}}}